ml-algos/linear_regression/model_metrics.json

{
  "features": [
    "area_sqft",
    "bedrooms",
    "age_years",
    "distance_city_km"
  ],
  "intercept": 11.908721923828125,
  "coefficients": [
    0.044921886175870895,
    7.500547409057617,
    -0.6398640275001526,
    -1.1406166553497314
  ],
  "rmse": 5.046719291812411,
  "r2": 0.9857078790664673
}

ml-algos/linear_regression/docs/README.md

## The basic mathematics

`price = 11.9087 + 0.04492*area + 7.50055*bedrooms - 0.63986*age - 1.14062*distance`